{
  "balance_sheet": {
    "assets": {
      "current_assets": {
        "accounts_receivable": 10449700,
        "cash": 11751200,
        "inventory": null,
        "other_current": 468900,
        "prepaid_expenses": 1675000,
        "total_current_assets": 24344800
      },
      "fixed_assets": {
        "accumulated_depreciation": null,
        "net_fixed_assets": 100500000,
        "property_plant_equipment": null
      },
      "other_assets": 17503200,
      "total_assets": 142348000
    },
    "equity": {
      "common_stock": null,
      "retained_earnings": null,
      "total_equity": 114797600
    },
    "liabilities": {
      "current_liabilities": {
        "accounts_payable": 7638000,
        "accrued_expenses": 4365200,
        "current_debt": 3395000,
        "other_current": null,
        "total_current_liabilities": 15398200
      },
      "long_term_liabilities": {
        "long_term_debt": 10838400,
        "other_long_term": 1313800,
        "total_long_term": 12152200
      },
      "total_liabilities": 27550400
    }
  },
  "header": {
    "audited": null,
    "company_name": "Lone Star Property Holdings, LP",
    "fiscal_year": 2026,
    "period_end_date": "2026-02-26",
    "period_type": null,
    "preparer": "Richard Thornton",
    "statement_type": "Financial Statements"
  },
  "income_statement": {
    "cost_of_goods_sold": 27495000,
    "gross_profit": 39505000,
    "income_before_tax": 11216300,
    "income_tax": 2638200,
    "interest_expense": 1878900,
    "net_income": 8578100,
    "operating_expenses": {
      "depreciation": 1895700,
      "insurance": null,
      "other_operating": null,
      "rent": null,
      "salaries_wages": null,
      "total_operating_expenses": 24514100,
      "utilities": null
    },
    "operating_income": 13095200,
    "revenue": {
      "gross_revenue": 67000000,
      "net_revenue": 67000000
    }
  },
  "ratios": {
    "current_ratio": 1.58,
    "debt_to_equity": 0.24,
    "profit_margin": 0.128
  }
}